{
  "id": "finansal",
  "kind": "section",
  "schemaVersion": "1.0.0",
  "lang": "tr",
  "order": 13,
  "slug": "finansal",
  "nav": {
    "num": "13",
    "label": "Finansal"
  },
  "background": "bg-1",
  "title": {
    "text": "Finansal model · yedi yıl",
    "accent": "yedi yıl"
  },
  "blocks": [
    {
      "text": "finansal · {{metric:fin.projection_months}} · 13 / 16",
      "type": "eyebrow"
    },
    {
      "level": 2,
      "text": "7 yıl. 7 senaryo değil, 1 plan.",
      "accent": "1 plan",
      "type": "heading"
    },
    {
      "text": "{{metric:fin.projection_months}}lık model, 15 sayfalık excel. Ana hatlar:",
      "type": "lead"
    },
    {
      "chartType": "yearlyHighlights",
      "dataRef": "financial-model",
      "caption": "Yıllık gelir / gider / net / kadro / nakit",
      "field": "yearly",
      "highlightYears": [
        "2026 H2",
        "2027",
        "2028",
        "2032"
      ],
      "columns": [
        "revenue",
        "expense",
        "net",
        "headcount",
        "cashEnd"
      ],
      "type": "chart"
    },
    {
      "chartType": "cashTeam",
      "dataRef": "financial-model",
      "caption": "Nakit + kadro · {{metric:fin.projection_months}}",
      "field": "yearly",
      "type": "chart"
    },
    {
      "text": "Kâr marjı 2027'den itibaren {{metric:fin.profit_margin_min}}. İlan reklam modelinde marjinal maliyet sıfıra yaklaşır; ek ilan ek maliyetsiz gelir.",
      "tone": "info",
      "type": "note"
    }
  ],
  "refs": {
    "shared": [
      "sources"
    ],
    "sources": [
      "model-v9-15"
    ],
    "data": [
      "financial-model",
      "hr-plan"
    ],
    "metrics": [
      "fin.profit_margin_min",
      "fin.projection_months"
    ]
  }
}