{
  "id": "gtm",
  "kind": "section",
  "schemaVersion": "1.0.0",
  "lang": "tr",
  "order": 9,
  "slug": "gtm",
  "nav": {
    "num": "09",
    "label": "Pazara giriş"
  },
  "background": "bg-4",
  "title": {
    "text": "Önce Ege'de dar bir bölgede yoğunlaşıyoruz",
    "accent": "dar bir bölgede"
  },
  "blocks": [
    {
      "text": "pazara giriş planı · 09 / 18",
      "type": "eyebrow"
    },
    {
      "level": 2,
      "text": "Önce Ege'de dar bir bölgede yoğunlaşıyoruz.",
      "accent": "dar bir bölgede",
      "type": "heading"
    },
    {
      "text": "Amaç, ulusal kampanyadan önce arz kalitesi ve satış sinyali üretmektir.",
      "type": "lead"
    },
    {
      "type": "columns",
      "left": [
        {
          "level": 3,
          "text": "Pazara giriş adımları",
          "accent": null,
          "type": "heading"
        },
        {
          "ordered": false,
          "items": [
            {
              "title": "Yıldız ilçede yoğunlaş",
              "body": "Bodrum, Çeşme, Urla, Didim, Kuşadası — arsa işlem yoğunluğu ve değeri en yüksek Ege ilçeleri.",
              "num": "01"
            },
            {
              "title": "Satıcı arzını kur",
              "body": "Kurucu satıcı programıyla ilk doğrulanmış ilanları topla.",
              "num": "02"
            },
            {
              "title": "İlan kalitesini standardize et",
              "body": "Her ilan aynı güven dosyası standardına geçer.",
              "num": "03"
            },
            {
              "title": "Alıcı güvenini veriyle artır",
              "body": "Emsal fiyat, doğrulama ve drone ile güven üret.",
              "num": "04"
            },
            {
              "title": "Formülü başka bölgelere taşı",
              "body": "Başarılı bölge modeli adım adım ölçeklenir.",
              "num": "05"
            }
          ],
          "type": "list"
        }
      ],
      "right": [
        {
          "level": 3,
          "text": "İlk 6 uygulanabilir büyüme hamlesi",
          "accent": null,
          "type": "heading"
        },
        {
          "ordered": false,
          "items": [
            {
              "title": "Bölgesel arz toplama",
              "body": "Sahadaki satıcı ağından ilk doğrulanmış ilanlar.",
              "num": "01"
            },
            {
              "title": "Kurucu satıcı programı",
              "body": "İlk satıcılara kalıcı kurucu statüsü ve öncelik.",
              "num": "02"
            },
            {
              "title": "Programatik bölge sayfaları",
              "body": "Her il, ilçe ve arsa tipi için aranabilir sayfa.",
              "num": "03"
            },
            {
              "title": "Drone ve doğrulama ile premium ilan",
              "body": "Güven dosyası tam dolu, öne çıkan ilan.",
              "num": "04"
            },
            {
              "title": "Diaspora alıcı kanalı",
              "body": "Yurt dışındaki Türk alıcıya yönelik satış kanalı.",
              "num": "05"
            },
            {
              "title": "Emlakçı paneli ve CRM",
              "body": "Saha emlakçısı için ilan ve müşteri yönetim ekranı.",
              "num": "06"
            }
          ],
          "type": "list"
        }
      ]
    },
    {
      "level": 3,
      "text": "İlçe-bazlı satış hedefleri (Ege yıldız ilçeleri)",
      "accent": null,
      "type": "heading"
    },
    {
      "text": "Hedefler il değil ilçe bazındadır: her ilçede önce yoğunluk kurulur, sonra komşu ilçeye taşınır. Yoğunluk eşiği ilçe başına ~50 aktif ilandır; eşik aşılınca emsal fiyat oluşur, alıcı ilgisi gelir ve bir sonraki ilçe açılır.",
      "highlight": [
        "il değil ilçe bazındadır",
        "~50 aktif ilan"
      ],
      "tone": "accent",
      "type": "note"
    },
    {
      "columns": [
        "İlçe",
        "İl",
        "Öncelik",
        "İlk yıl hedef aktif ilan"
      ],
      "rows": [
        ["Bodrum", "Muğla", "Yıldız", "90"],
        ["Çeşme", "İzmir", "Yıldız", "70"],
        ["Urla", "İzmir", "Yıldız", "55"],
        ["Didim", "Aydın", "Yüksek", "45"],
        ["Kuşadası", "Aydın", "Yüksek", "40"]
      ],
      "type": "table"
    },
    {
      "text": "İlk yıl 5 yıldız ilçede toplam ~300 doğrulanmış aktif ilan hedeflenir. Yayılım mantığı: İlçe → İl → Bölge → Ulusal; yoğunluk eşiği geçilmeden genişleme yapılmaz.",
      "tone": "info",
      "type": "note"
    },
    {
      "level": 3,
      "text": "Araçlı saha ekipleri: önce keşfet, sonra sat",
      "accent": "önce keşfet, sonra sat",
      "type": "heading"
    },
    {
      "type": "columns",
      "left": [
        {
          "level": 3,
          "text": "Araçlı saha KEŞİF ekibi",
          "accent": null,
          "type": "heading"
        },
        {
          "ordered": false,
          "items": [
            {
              "title": "Kim?",
              "body": "Araç başına 2 kişi (sürücü + saha analisti); satış yapmaz.",
              "num": "01"
            },
            {
              "title": "Bölgeyi keşfeder",
              "body": "İlçedeki boş/satışa hazır arsa envanterini tapu + saha turuyla yerinde saptar.",
              "num": "02"
            },
            {
              "title": "Satıcı adayını işler",
              "body": "Mülk koordinatı, yaklaşık m² ve konum skorunu ParselQ CRM'e \"potansiyel satıcı\" olarak yazar.",
              "num": "03"
            },
            {
              "title": "Kapasite",
              "body": "Günde 15-20 arsa tespiti, haftada 60-80 satıcı adayı.",
              "num": "04"
            }
          ],
          "type": "list"
        }
      ],
      "right": [
        {
          "level": 3,
          "text": "Araçlı saha SATIŞ ekibi",
          "accent": null,
          "type": "heading"
        },
        {
          "ordered": false,
          "items": [
            {
              "title": "Kim?",
              "body": "Araç başına 2 kişi (kıdemli satış + teknik asistan); hesap açmadan ayrılmaz.",
              "num": "01"
            },
            {
              "title": "Adayı ziyaret eder",
              "body": "Keşif ekibinin CRM'e düştüğü adayları 24 saat içinde sıralı ziyarete alır.",
              "num": "02"
            },
            {
              "title": "İlanı birlikte açar",
              "body": "Sahada AI değerleme raporunu sunar, hesap açar, tapu fotoğrafını alır, ilanı canlıya alır.",
              "num": "03"
            },
            {
              "title": "Kapasite",
              "body": "Günde 6-8 ziyaret, %30-40 dönüşüm → günde 2-3 canlı ilan.",
              "num": "04"
            }
          ],
          "type": "list"
        }
      ]
    },
    {
      "text": "El değiştirme protokolü: Keşif ekibi CRM'e satıcı adayı ekler → Satış ekibi 24 saat içinde ziyaret planına alır → ziyarette hesap açılır ve ilan yüklenir → 72 saatte yayına girmezse satış ekibi arama/SMS ile kapanışa iter → iki ekip pazartesi sabahı ilçe haritasını birlikte günceller.",
      "highlight": [
        "El değiştirme protokolü"
      ],
      "tone": "info",
      "type": "note"
    },
    {
      "level": 3,
      "text": "Saha ekibinin günlük döngüsü",
      "accent": null,
      "type": "heading"
    },
    {
      "type": "timeline",
      "items": [
        {
          "when": "Pazartesi",
          "what": "Hedef ilçe ve satıcı ziyaret listesi"
        },
        {
          "when": "Salı–Çarşamba",
          "what": "Saha ziyareti, portföy ve satıcı görüşmesi"
        },
        {
          "when": "Perşembe",
          "what": "İlan dosyası, foto/keşif ve doğrulama"
        },
        {
          "when": "Cuma",
          "what": "Rapor ve kapanış takibi"
        }
      ]
    },
    {
      "text": "Her hafta aynı ritim çalışır; saha disiplini reklamdan önce gelir.",
      "tone": "info",
      "type": "note"
    },
    {
      "text": "Bu plan 'rakibi nasıl yeneriz' değil, 'nasıl kazanırız' sorusunu cevaplar.",
      "tone": "info",
      "type": "note"
    }
  ],
  "refs": {
    "metrics": []
  }
}