{
  "id": "roadmap",
  "kind": "section",
  "schemaVersion": "1.0.0",
  "lang": "tr",
  "order": 11,
  "slug": "roadmap",
  "nav": {
    "num": "11",
    "label": "Roadmap · Risk"
  },
  "background": "bg-3",
  "title": {
    "text": "Rakip gördüğünde ne yapar?",
    "accent": "gördüğünde"
  },
  "blocks": [
    {
      "text": "roadmap + risk · 11 / 16",
      "type": "eyebrow"
    },
    {
      "level": 2,
      "text": "Sahibinden bizi farkettiğinde savunma cephanemiz hazır.",
      "accent": "savunma cephanemiz hazır",
      "type": "heading"
    },
    {
      "text": "Her riskin yanıtı önceden çizildi. Sürpriz yok, senaryo var.",
      "type": "lead"
    },
    {
      "level": 3,
      "text": "Kopyalanamaz olduğumuz alanlar",
      "accent": null,
      "type": "heading"
    },
    {
      "cols": 2,
      "items": [
        {
          "title": "Sahibinden kendi gelirini öldüremez.",
          "tone": "accent",
          "type": "card",
          "body": "Modelimizi kopyalamak için yıllık {{metric:competitor.sahibinden_commission}} ilan komisyonundan vazgeçmek zorunda. Yapısal tuzak.",
          "eyebrow": "01 · Komisyonsuz model"
        },
        {
          "title": "Genel emlak ≠ arsa uzmanlığı.",
          "tone": "accent",
          "type": "card",
          "body": "TAKBİS API, drone, imar AI, parsel sınır overlay — yatay platformlar bu derinliğe inerse kendi konfor alanlarını bozar.",
          "eyebrow": "02 · Dikey pazaryeri"
        },
        {
          "title": "Tek ilçe, tam doygunluk.",
          "tone": "accent",
          "type": "card",
          "body": "Söke + Bodrum + Aydın'da %60+ pazar payı. Ulusal oyuncunun zaman matematiği tutmaz.",
          "eyebrow": "03 · Atomik ağ"
        },
        {
          "title": "Resmi entegrasyon, bürokratik moat.",
          "tone": "accent",
          "type": "card",
          "body": "TAKBİS resmi API entegrasyonu ~14 ay onay süreci. Bu süreçte biz pazarı kuruyor olacağız.",
          "eyebrow": "04 · Tapu doğrulama"
        },
        {
          "title": "Türkiye dışından alıcı havuzu.",
          "tone": "accent",
          "type": "card",
          "body": "Berlin, Köln, KKTC, Bakü ofis ağı. €/TRY arbitrajıyla doğal moat.",
          "eyebrow": "05 · Diaspora kanalı"
        },
        {
          "title": "{{metric:team.lean}}, 700 kişiyi yener.",
          "tone": "accent",
          "type": "card",
          "body": "Biz bir günde test edip yayına alırız. Karar hızı = kapatılamayacak uçurum.",
          "eyebrow": "06 · Hız asimetrisi"
        }
      ],
      "type": "cardGrid"
    },
    {
      "level": 3,
      "text": "12 ay · dört dönüm",
      "accent": null,
      "type": "heading"
    },
    {
      "cols": 2,
      "items": [
        {
          "title": "Kuruluş + atomik ağ",
          "tone": null,
          "type": "card",
          "body": "A.Ş. tescili · Söke pilot · 100 satıcı.",
          "eyebrow": "Q3 2026"
        },
        {
          "title": "Ulusal lansman",
          "tone": null,
          "type": "card",
          "body": "81 il · 5.000 ilan hedefi.",
          "eyebrow": "Q4 2026"
        },
        {
          "title": "Operasyonel başabaş",
          "tone": null,
          "type": "card",
          "body": "Aylık gelir > gider · {{metric:fin.headcount_2027}}.",
          "eyebrow": "H1 2027"
        },
        {
          "title": "Diaspora yayılımı",
          "tone": null,
          "type": "card",
          "body": "Berlin · Köln · Lefkoşa · Bakü.",
          "eyebrow": "2028+"
        }
      ],
      "type": "cardGrid"
    },
    {
      "level": 3,
      "text": "Risk · yanıt",
      "accent": null,
      "type": "heading"
    },
    {
      "columns": [
        "Risk",
        "Seviye",
        "Yanıt"
      ],
      "rows": [
        [
          "Sahibinden agresif reklamı / tepki",
          "Yüksek",
          "Counter-positioning · komisyon modelini bırakamaz (gelirinin ~%30'u); taklit kendi ekonomisini bozar"
        ],
        [
          "EİDS / SPK ek regülasyon",
          "Orta",
          "Tapu doğrulama ilk günden EİDS uyumlu; ek katman bizim avantajımıza"
        ],
        [
          "Tedarikçi kaynağı kuruması (cold-start)",
          "Orta",
          "Mevcut arsa stoğu seed · ilk 1000 satıcıya kurucu rozeti + ücretsiz drone"
        ],
        [
          "USD/TRY kur volatilitesi",
          "Düşük",
          "USD bazlı maliyet OPEX'in %18'i · hibrit AI altyapı · %20 cap"
        ],
        [
          "Avrupa diaspora kaybı",
          "Düşük",
          "'Toprağını geri al' anlatısı + dil katmanları (DE, NL, FR) + SEPA/IBAN"
        ]
      ],
      "type": "table"
    }
  ],
  "refs": {
    "glossary": [
      "EİDS",
      "TAKBİS",
      "Counter-Positioning"
    ],
    "metrics": [
      "competitor.sahibinden_commission",
      "fin.headcount_2027",
      "team.lean"
    ]
  }
}