{
  "id": "urun",
  "kind": "section",
  "schemaVersion": "1.0.0",
  "lang": "tr",
  "order": 4,
  "slug": "urun",
  "nav": {
    "num": "04",
    "label": "Ürün"
  },
  "background": "bg-4",
  "title": {
    "text": "Arsa için tasarlanmış platform",
    "accent": "tasarlanmış"
  },
  "blocks": [
    {
      "text": "ürün · 04 / 16",
      "type": "eyebrow"
    },
    {
      "level": 2,
      "text": "Arsa için tasarlanmış platform.",
      "accent": "tasarlanmış",
      "type": "heading"
    },
    {
      "text": "sahibinden'de bulunmayan beş katman. Her biri güven üreten, her biri ayrı ücretlendirme imkânı.",
      "type": "lead"
    },
    {
      "ordered": true,
      "items": [
        {
          "title": "Tapu doğrulama",
          "body": "EİDS entegre. Her ilan tapu kayıtlarıyla eşlenmiş. Sahte ilan sıfır.",
          "num": "T"
        },
        {
          "title": "Drone tur",
          "body": "Premium ilanlara ücretsiz drone keşif. Arsa fotoğrafçılığı çözümlü.",
          "num": "D"
        },
        {
          "title": "Emsal fiyat grafiği",
          "body": "Aynı parsel için bölgesel m² geçmişi. Fiyat dağınıklığı şeffaflıkla çözülür.",
          "num": "F"
        },
        {
          "title": "İnteraktif harita",
          "body": "Kadastro + imar + jeoloji katmanları. Tek ekranda arsanın tüm hikâyesi.",
          "num": "H"
        },
        {
          "title": "Emanet ödeme",
          "body": "Tapu transferine kadar bedel arsam.net'te. Kapora kaybolmaz.",
          "num": "E"
        }
      ],
      "type": "list"
    }
  ],
  "refs": {
    "glossary": [
      "EİDS",
      "TAKBİS"
    ],
    "metrics": []
  }
}