{
  "id": "bootstrap",
  "kind": "section",
  "schemaVersion": "1.0.0",
  "lang": "tr",
  "order": 9,
  "slug": "bootstrap",
  "nav": {
    "num": "09",
    "label": "Bootstrap"
  },
  "background": "bg-1",
  "title": {
    "text": "Bootstrap · kontrollü yakım",
    "accent": "kontrollü yakım"
  },
  "blocks": [
    {
      "text": "başabaş · 09 / 16",
      "type": "eyebrow"
    },
    {
      "level": 2,
      "text": "{{metric:capital.investor_pocket}}. Sonra makine kendi enerjisini üretir.",
      "accent": "kendi enerjisini üretir",
      "type": "heading"
    },
    {
      "text": "Klasik startup'ın 30-50M $'lık burn rate'i yok. Risk belirsiz değil — ölçülmüş, sınırlı.",
      "type": "lead"
    },
    {
      "title": "başabaş — operasyonel",
      "valueRef": "capital.breakeven_spend",
      "desc": "18. ay ({{metric:fin.breakeven_month}}) itibarıyla aylık gelir, aylık gideri karşılıyor. Bu noktadan sonra net pozitif.",
      "items": [
        {
          "title": "Personel · maaş + sigorta + ikramiye",
          "num": "01"
        },
        {
          "title": "CPO araç tahsisi",
          "num": "02"
        },
        {
          "title": "Ofis kurulumu + sabit gider",
          "num": "03"
        },
        {
          "title": "Dijital pazarlama bütçesi",
          "num": "04"
        },
        {
          "title": "AI + yazılım altyapısı",
          "num": "05"
        },
        {
          "title": "Hukuk + danışmanlık + sertifikasyon",
          "num": "06"
        }
      ],
      "type": "feature"
    },
    {
      "cols": 3,
      "items": [
        {
          "label": "başlangıç sermayesi",
          "tone": null,
          "type": "stat",
          "valueRef": "capital.total_raised",
          "sub": "finansal modelin tabanı · ilk kurulum + ilk {{metric:fin.breakeven_months}}"
        },
        {
          "label": "başabaşa kadar harcanacak",
          "tone": "gold",
          "type": "stat",
          "valueRef": "capital.breakeven_spend",
          "sub": "altı ana kalem dahil, tam yüklü hesap"
        },
        {
          "label": "başabaş sonrası kasada",
          "tone": "accent",
          "type": "stat",
          "valueRef": "capital.reserve",
          "sub": "2027 ulusal kampanyaya kadar yedek"
        }
      ],
      "type": "statGrid"
    },
    {
      "items": [
        {
          "when": "Tem 2026",
          "what": "yazılım hazır · soft launch · ilk 100 ilan",
          "state": "done"
        },
        {
          "when": "Ara 2026",
          "what": "{{metric:fin.headcount_2026}} · 1,4M ₺ kümülatif gelir",
          "state": "done"
        },
        {
          "when": "{{metric:fin.breakeven_month}} · başabaş",
          "what": "aylık gelir > aylık gider · {{metric:capital.breakeven_spend}} harcandı · makine kendi enerjisini üretir",
          "state": "now"
        },
        {
          "when": "Ara 2027",
          "what": "{{metric:fin.headcount_2027}} · {{metric:fin.revenue_2027}} yıllık gelir · ulusal kampanya başlar",
          "state": "next"
        }
      ],
      "type": "timeline"
    },
    {
      "text": "Webvan 830M $'la battı çünkü ürün-pazar uyumu kanıtlanmadan ölçeklendi. Biz tersine: {{metric:capital.breakeven_spend}}'lik kontrollü yakım, sonra kâr ile büyüme.",
      "tone": "info",
      "type": "note"
    }
  ],
  "refs": {
    "data": [
      "financial-model"
    ],
    "metrics": [
      "capital.breakeven_spend",
      "capital.investor_pocket",
      "capital.reserve",
      "capital.total_raised",
      "fin.breakeven_month",
      "fin.breakeven_months",
      "fin.headcount_2026",
      "fin.headcount_2027",
      "fin.revenue_2027"
    ]
  }
}