{
  "id": "teknopark",
  "kind": "section",
  "schemaVersion": "1.0.0",
  "lang": "tr",
  "order": 10,
  "slug": "teknopark",
  "nav": {
    "num": "10",
    "label": "Teknopark"
  },
  "background": "bg-2",
  "title": {
    "text": "Mecidiyeköy değil İTÜ ARI",
    "accent": "İTÜ ARI"
  },
  "blocks": [
    {
      "text": "teknopark · 4691 · 10 / 16",
      "type": "eyebrow"
    },
    {
      "level": 2,
      "text": "Eğer şirketi teknopark'ta açarsak, {{metric:tax.saving_2027}} ilk yıl vergi tasarrufu.",
      "accent": "vergi tasarrufu",
      "type": "heading"
    },
    {
      "text": "Kira benzer. Vergi sıfır. 4691 sayılı kanun, yazılım kazançlarını {{metric:tax.valid_until}}'e kadar kurumlar vergisinden istisna tutar.",
      "type": "lead"
    },
    {
      "items": [
        "İstanbul Aydın Üni.",
        "Zaim Üni.",
        "Entertech İstanbul Teknokent",
        "YTÜ Yıldız Teknopark",
        "İTÜ ARI Teknokent",
        "ODTÜ Teknokent",
        "Teknopark İstanbul",
        "Hacettepe Teknokent",
        "Cyberpark Bilkent",
        "Sabancı Teknopark",
        "Marmara Teknopark"
      ],
      "type": "pillRow"
    },
    {
      "cols": 3,
      "items": [
        {
          "label": "Kurumlar vergisi istisnası",
          "tone": "gold",
          "type": "stat",
          "valueRef": "tax.corporate_rate"
        },
        {
          "label": "Gelir vergisi stopajı muafiyeti",
          "tone": "gold",
          "type": "stat",
          "valueRef": "tax.income_withholding"
        },
        {
          "label": "SGK işveren payı desteği",
          "tone": "gold",
          "type": "stat",
          "valueRef": "tax.sgk_employer"
        }
      ],
      "type": "statGrid"
    },
    {
      "title": "olgun yıllık vergi tasarrufu",
      "valueRef": "tax.saving_mature_annual",
      "desc": "Dört ana kalem birlikte. Ek olarak damga vergisi muafiyeti, AR-GE proje hizmetlerinde gümrük ve fon istisnası.",
      "items": [
        {
          "title": "Kurumlar vergisi · {{metric:tax.corporate_rate}} · münhasıran yazılım kazançları",
          "num": "01"
        },
        {
          "title": "AR-GE personel gelir vergisi · tam istisna ({{metric:tax.income_withholding}} stopaj)",
          "num": "02"
        },
        {
          "title": "SGK işveren payı · {{metric:tax.sgk_employer}} hazine desteği",
          "num": "03"
        },
        {
          "title": "Yazılım satışı KDV istisnası · onaylı proje kapsamında",
          "num": "04"
        }
      ],
      "type": "feature"
    },
    {
      "level": 3,
      "text": "EBITDA marjı · 7 yıllık etki",
      "accent": null,
      "type": "heading"
    },
    {
      "chartType": "ebitda",
      "dataRef": "financial-model",
      "caption": "EBITDA marjı 7 yıllık projeksiyon",
      "type": "chart"
    },
    {
      "cols": 2,
      "items": [
        {
          "title": "7 yıl kümülatif",
          "tone": "gold",
          "type": "card",
          "body": "2027–2032 · 4691 no'lu kanun kapsamı · yatırım turunun {{metric:tax.investment_multiple}}ı",
          "eyebrow": "Kümülatif",
          "valueRef": "tax.saving_cumulative_7y"
        },
        {
          "title": "2032 EBITDA marjı",
          "tone": "gold",
          "type": "card",
          "body": "vergi yükü kalktığında",
          "eyebrow": "olgun",
          "valueRef": "tax.ebitda_2032"
        }
      ],
      "type": "cardGrid"
    },
    {
      "text": "Süre sınırı {{metric:tax.valid_until}} ama tarihsel olarak hep uzatıldı (2013 → 2023 → 2028 → muhtemel 2033). Model bu uzatmayı dahil etmiyor; muhafazakar varsayım altında bile 2027-2028 iki yılda {{metric:tax.saving_two_year}} garanti tasarruf.",
      "tone": "info",
      "type": "note"
    }
  ],
  "refs": {
    "shared": [
      "sources"
    ],
    "sources": [
      "kanun-4691",
      "kanun-5746"
    ],
    "data": [
      "incentives",
      "financial-model"
    ],
    "glossary": [
      "4691",
      "EBITDA"
    ],
    "metrics": [
      "tax.corporate_rate",
      "tax.ebitda_2032",
      "tax.income_withholding",
      "tax.investment_multiple",
      "tax.saving_2027",
      "tax.saving_cumulative_7y",
      "tax.saving_mature_annual",
      "tax.saving_two_year",
      "tax.sgk_employer",
      "tax.valid_until"
    ]
  }
}