{
  "id": "risk",
  "kind": "section",
  "schemaVersion": "1.0.0",
  "lang": "tr",
  "order": 14,
  "slug": "risk",
  "nav": {
    "num": "14",
    "label": "Risk"
  },
  "background": "bg-1",
  "title": {
    "text": "Her riskin bir ölçümü ve bir kararı var",
    "accent": "ölçümü ve bir kararı"
  },
  "blocks": [
    {
      "text": "risk ve kontrol kapıları · 14 / 18",
      "type": "eyebrow"
    },
    {
      "level": 2,
      "text": "Her riskin bir ölçümü ve bir kararı var.",
      "accent": "ölçümü ve bir kararı",
      "type": "heading"
    },
    {
      "text": "Önemli olan rakip değil; hangi sırayla ne yapacağımız ve nerede duracağımız.",
      "type": "lead"
    },
    {
      "level": 3,
      "text": "Yatırımcıyı koruyan ek riskler",
      "type": "heading"
    },
    {
      "cols": 3,
      "items": [
        {
          "title": "İtibar riski",
          "body": "Sahte ilan/yanlış değerleme yatırımcının itibarını yıpratabilir. İlk ciddi olayda: manuel inceleme, hukuk onayı, yayın durdurma.",
          "tone": "warn",
          "type": "card"
        },
        {
          "title": "Ortaklık karar çatışması",
          "body": "Kritik karar 7 günü aşarsa: yetki matrisi devreye girer, yönetim toplantısı yapılır.",
          "tone": "warn",
          "type": "card"
        },
        {
          "title": "Yanlış değerleme beklentisi",
          "body": "Değerleme itirazı eşiği aşarsa: 'bilgilendirme amaçlı' etiket ve eksper ortaklığı.",
          "tone": "warn",
          "type": "card"
        }
      ],
      "type": "cardGrid"
    },
    {
      "text": "Riskler belirsiz değil; ölçülü ve karar kapısına bağlı. Her risk bir eşik ve bir aksiyona bağlanır.",
      "tone": "info",
      "type": "note"
    },
    {
      "columns": [
        "Risk",
        "Ölçüm",
        "Karar kapısı",
        "Aksiyon"
      ],
      "rows": [
        [
          "Satıcı arzı beklenenden yavaş oluşur",
          "İlk 90 günde aktif doğrulanmış ilan sayısı",
          "Hedefin altındaysa",
          "Bölge daraltma · kurucu satıcı teşviki · saha satış desteği"
        ],
        [
          "Alıcı güveni düşük kalır",
          "İlan başına iletişim ve dönüşüm",
          "Eşik altındaysa",
          "Doğrulama katmanını ve emsal veriyi güçlendir"
        ],
        [
          "Kur oynaklığı maliyeti artırır",
          "USD bazlı gider payı (OPEX)",
          "%20 üstüne çıkarsa",
          "Hibrit altyapı · harcama kısıtı"
        ],
        [
          "Regülasyon (EİDS/SPK) sıkılaşır",
          "Uyum açığı",
          "Yeni şart geldiğinde",
          "İlk günden EİDS-uyumlu altyapı avantaja döner"
        ],
        [
          "Sahibinden agresif karşılık verir",
          "Rakibin arsa kategorisinde ücretsiz ilan kampanyası",
          "Kampanya açılırsa",
          "Counter-Positioning: komisyon ekonomisini bırakamaz; dikey derinlik + kurucu satıcı sadakati korur"
        ],
        [
          "Avrupa diasporası rakibe sadık kalır",
          "Diaspora kanalı dönüşümü",
          "Beklenenin altındaysa",
          "'Toprağını geri al' anlatısı + dil katmanları (DE/NL/FR) + SEPA/IBAN ödeme"
        ]
      ],
      "type": "table"
    },
    {
      "text": "Bu tablo sürpriz değil, senaryo üretir; her risk bir karar kapısına bağlıdır.",
      "tone": "info",
      "type": "note"
    }
  ],
  "refs": {
    "glossary": [
      "EİDS"
    ],
    "metrics": []
  }
}