{
  "id": "problem",
  "kind": "section",
  "schemaVersion": "1.0.0",
  "lang": "tr",
  "order": 4,
  "slug": "problem",
  "nav": {
    "num": "04",
    "label": "Problem"
  },
  "background": "bg-4",
  "title": {
    "text": "Arsa, dijitalde güven maliyeti yüksek bir üründür",
    "accent": "güven maliyeti yüksek"
  },
  "blocks": [
    {
      "text": "problem · 04 / 18",
      "type": "eyebrow"
    },
    {
      "level": 2,
      "text": "Arsa, dijitalde güven maliyeti yüksek bir üründür.",
      "accent": "güven maliyeti yüksek",
      "type": "heading"
    },
    {
      "text": "Alıcı yalnızca fotoğrafa değil; tapu, imar, konum, emsal fiyat ve satıcı doğruluğuna bakar. Mevcut yatay platformlar bu bilgileri standart bir güven dosyasına dönüştürmez.",
      "type": "lead"
    },
    {
      "ordered": false,
      "items": [
        {
          "title": "Aynı parsel, farklı ilanlarda farklı fiyat",
          "body": "Emsal ve doğrulama standardı olmadığı için fiyat dağınık kalır.",
          "num": "01"
        },
        {
          "title": "Tapu ve imar bilgisi ilanda standart değil",
          "body": "Alıcı kritik bilgiyi ilan dışından, dağınık biçimde arar.",
          "num": "02"
        },
        {
          "title": "Kapora ve sahte ilan riski alıcı güvenini düşürür",
          "body": "Ön ödeme için güvenli bir protokol yoktur.",
          "num": "03"
        },
        {
          "title": "EİDS ile ilan doğrulama artık yasal zorunluluk",
          "body": "Elektronik ilan doğrulama yürürlüktedir; uyumsuz platformlar idari ceza riski taşır. arsam.net ilk günden EİDS uyumlu kurulur — hazır olmayan rakip için maliyet, bizim için avantaj.",
          "num": "04"
        },
        {
          "title": "Kategori körlüğü: arsa, evin yanına atılmış bir sekme",
          "body": "Yatay platformlarda imar, kadastro, jeoloji ve drone hiçbiri standart değil; arsaya özgü araç yok.",
          "num": "05"
        }
      ],
      "type": "list"
    },
    {
      "text": "Amaç korkutmak değil; arsa için neden dikey uzmanlık gerektiğini göstermek.",
      "tone": "info",
      "type": "note"
    },
    {
      "level": 3,
      "text": "Sahanın günlük sürtünmesi",
      "type": "heading"
    },
    {
      "cols": 2,
      "items": [
        {
          "title": "Alıcı kör arıyor",
          "body": "Alıcı parseli anlamadan onlarca ilan arasında kayboluyor.",
          "type": "card"
        },
        {
          "title": "Fiyat kulaktan",
          "body": "Satıcı fiyatı komşudan duyduğu rakama göre koyuyor.",
          "type": "card"
        },
        {
          "title": "Dağınık ilan",
          "body": "Aynı yer üç farklı ilanda üç farklı görünüyor.",
          "type": "card"
        },
        {
          "title": "Geç çıkan belge",
          "body": "Tapu ve imar bilgisi konuşmanın sonunda ortaya çıkıyor.",
          "type": "card"
        }
      ],
      "type": "cardGrid"
    },
    {
      "text": "Bu sorunlar teknoloji sorunu değil, arsa işinin günlük sürtünmesidir. Teknoloji yalnız bu sürtünmeyi görünür ve yönetilebilir hale getirir.",
      "tone": "info",
      "type": "note"
    }
  ],
  "refs": {
    "glossary": [
      "EİDS"
    ],
    "metrics": []
  }
}