{
  "id": "ik-plani",
  "kind": "section",
  "schemaVersion": "1.0.0",
  "lang": "tr",
  "order": 12,
  "slug": "ik-plani",
  "nav": {
    "num": "12",
    "label": "İK planı"
  },
  "background": "bg-3",
  "title": {
    "text": "Kadro, gelir ve riske göre büyür",
    "accent": "gelir ve riske göre"
  },
  "blocks": [
    {
      "text": "İK planı · 12 / 18",
      "type": "eyebrow"
    },
    {
      "level": 2,
      "text": "Kadro, gelir ve riske göre büyür.",
      "accent": "gelir ve riske göre",
      "type": "heading"
    },
    {
      "text": "Hangi rol gelir üretir, hangi rol riski azaltır — kadro buna göre planlanır.",
      "type": "lead"
    },
    {
      "chartType": "headcountMonthly",
      "dataRef": "financial-detail",
      "caption": "2026 · aylık işe alım (Ağustos 5 çekirdek → Aralık 38 kişi · agresif/öne-yüklü)",
      "type": "chart"
    },
    {
      "chartType": "headcountGrowth",
      "dataRef": "hr-plan",
      "caption": "Kadro büyümesi · 2026 (38) → 2031 (256); ara yıllar 92 · 140 · 185 · 225 (agresif/öne-yüklü)",
      "type": "chart"
    },
    {
      "cols": 3,
      "items": [
        {
          "title": "Gelir üreten roller",
          "tone": "accent",
          "type": "card",
          "body": "Satış/satıcı operasyonu, pazarlama, ürün ve büyüme.",
          "eyebrow": "kadro"
        },
        {
          "title": "Riski azaltan roller",
          "tone": "gold",
          "type": "card",
          "body": "Hukuk ve uyum, doğrulama/güven, finans.",
          "eyebrow": "kadro"
        },
        {
          "title": "Operasyon rolleri",
          "tone": null,
          "type": "card",
          "body": "Müşteri deneyimi, moderasyon, içerik.",
          "eyebrow": "kadro"
        }
      ],
      "type": "cardGrid"
    },
    {
      "level": 3,
      "text": "Saha ve ParselQ rolleri",
      "accent": null,
      "type": "heading"
    },
    {
      "cols": 1,
      "items": [
        {
          "eyebrow": "saha · araçlı",
          "title": "Araçlı saha keşif uzmanı",
          "body": "Bölgeyi keşfeder; boş/satışa hazır arsa envanterini ve satıcı adaylarını yerinde tespit edip ParselQ CRM'e işler. Satış yapmaz.",
          "tone": "accent",
          "type": "card"
        },
        {
          "eyebrow": "saha · araçlı",
          "title": "Araçlı saha satış uzmanı",
          "body": "Keşif ekibinin adaylarını ziyaret eder; AI değerleme sunar, hesap açar, tapuyu alır, ilanı canlıya alır. Hesap açmadan ayrılmaz.",
          "tone": "accent",
          "type": "card"
        },
        {
          "eyebrow": "ParselQ",
          "title": "RFQ operasyon & eşleştirme uzmanı",
          "body": "Talep→teklif→seçim→kapanış akışını uçtan uca yönetir; eşleştirme kurallarını ve SLA'ları işletir, kurumsal RFQ müşterilerine destek verir.",
          "tone": "gold",
          "type": "card"
        },
        {
          "eyebrow": "ParselQ",
          "title": "Sosyal topluluk & moderasyon uzmanı",
          "body": "Instagram-Twitter arası enerjik sosyal keşif katmanını büyütür ve sağlıklı tutar; AI destekli içerik moderasyonunu işletir.",
          "tone": "gold",
          "type": "card"
        },
        {
          "eyebrow": "AI / veri",
          "title": "AI değerleme & veri mühendisi",
          "body": "Değerleme modelini kalibre eder; TKGM/CBS veri akışını, emsal analizini ve risk skorunu üretir (çıktı bilgilendirme amaçlı).",
          "tone": null,
          "type": "card"
        }
      ],
      "type": "cardGrid"
    },
    {
      "level": 3,
      "text": "Kadro dağılımı · yıl sekmeleriyle filtrele",
      "accent": "yıl sekmeleriyle filtrele",
      "type": "heading"
    },
    {
      "chartType": "deptByYear",
      "dataRef": "hr-by-year",
      "caption": "Departman × yıl kadro dağılımı · sekmeye tıklayarak yılı seç (2026 → 2032). Yıl toplamları: 38 · 92 · 140 · 185 · 225 · 256 · 256.",
      "type": "chart"
    },
    {
      "text": "2031'de kadronun %34'ü (88 kişi) araçlı saha ekiplerinde, %12,5'i (32 kişi) ParselQ RFQ/sosyal katmanındadır — bu, arsa pazarının saha ve güven işi olduğunu yansıtır. Yıl sekmeleriyle erken yılların saha-önce dağılımını da görebilirsin.",
      "highlight": [
        "%34'ü (88 kişi) araçlı saha"
      ],
      "tone": "accent",
      "type": "note"
    },
    {
      "text": "Organizasyon yalın squad yapısındadır: her squad 4-7 kişi, kendi backlog'u ve doğrudan raporlaması olur. Erken aşamada SAFe/ART gibi ağır ölçekleme çerçeveleri kullanılmaz; öncelik bürokrasi değil hızdır.",
      "highlight": [
        "yalın squad yapısındadır",
        "SAFe/ART gibi ağır ölçekleme çerçeveleri kullanılmaz"
      ],
      "tone": "info",
      "type": "note"
    },
    {
      "text": "Kadro 2026 Ağustos'ta 5 çekirdek rolle başlar, 2026 sonunda 38'e, sonra 92 · 140 · 185 · 225 ara basamaklarından geçerek 2031 sonunda 256 kişilik AI-first organizasyona ulaşır; agresif/öne-yüklü işe alım (özellikle Saha Keşif) erken saha likiditesini hızlandırır, her ekleme bir gerekçeye bağlıdır.",
      "highlight": [
        "her ekleme bir gerekçeye bağlıdır"
      ],
      "tone": "info",
      "type": "note"
    },
    {
      "level": 3,
      "text": "256 kişi ilk gün değil; kapı kapı",
      "accent": null,
      "type": "heading"
    },
    {
      "cols": 2,
      "items": [
        {
          "title": "İlan stoğu kapısı",
          "body": "Doğrulanmış arz oluştukça saha kadrosu açılır."
        },
        {
          "title": "Talep kapısı",
          "body": "Alıcı talebi büyüdükçe satış/RFQ ekibi büyür."
        },
        {
          "title": "Gelir sinyali kapısı",
          "body": "Ücretli dönüşüm geldikçe işe alım hızlanır."
        },
        {
          "title": "Operasyon yükü kapısı",
          "body": "İş hacmi gerektirdikçe destek/ops eklenir."
        }
      ],
      "type": "cardGrid"
    },
    {
      "text": "256 kişi ilk gün alınacak ekip değildir. Her işe alım bir kapıya bağlıdır: ilan stoğu, talep sayısı, gelir sinyali, operasyon yükü.",
      "tone": "info",
      "type": "note"
    }
  ],
  "refs": {
    "data": [
      "hr-plan",
      "hr-master-256",
      "financial-detail",
      "hr-by-year"
    ],
    "metrics": []
  }
}